22:24:37.036086 IP 127.0.0.1.54120 > 127.0.0.1.8080: Flags [S], seq 3806237981, win 65495, options [mss 65495,sackOK,TS val 516986604 ecr 0,nop,wscale 7], length 0
E..<..@.@............h...............0.........
............
22:24:37.036096 IP 127.0.0.1.8080 > 127.0.0.1.54120: Flags [S.], seq 4255645791, ack 3806237982, win 65483, options [mss 65495,sackOK,TS val 516986604 ecr 516986604,nop,wscale 7], length 0
E..<..@.@.<............h..._.........0.........
............
22:24:37.036102 IP 127.0.0.1.54120 > 127.0.0.1.8080: Flags [.], ack 1, win 512, options [nop,nop,TS val 516986604 ecr 516986604], length 0
E..4..@.@............h.........`.....(.....
........
22:24:37.036169 IP 127.0.0.1.54120 > 127.0.0.1.8080: Flags [P.], seq 1:176, ack 1, win 512, options [nop,nop,TS val 516986604 ecr 516986604], length 175: HTTP: POST /notes HTTP/1.1
E.....@.@..G.........h.........`...........
........POST /notes HTTP/1.1
Host: localhost:8080
User-Agent: curl/7.81.0
Accept: */*
Content-Type: application/json
Content-Length: 39

{"title":"trace me","body":"in flight"}
22:24:37.036171 IP 127.0.0.1.8080 > 127.0.0.1.54120: Flags [.], ack 176, win 511, options [nop,nop,TS val 516986604 ecr 516986604], length 0
E..4..@.@.."...........h...`.........(.....
........
22:24:37.042141 IP 127.0.0.1.8080 > 127.0.0.1.54120: Flags [P.], seq 1:207, ack 176, win 512, options [nop,nop,TS val 516986610 ecr 516986604], length 206: HTTP: HTTP/1.1 201 Created
E.....@.@..S...........h...`...............
........HTTP/1.1 201 Created
Content-Type: application/json
Date: Tue, 16 Jun 2026 19:24:37 GMT
Content-Length: 93

{"id":5,"title":"trace me","body":"in flight","created_at":"2026-06-16T19:24:37.036818895Z"}

22:24:37.042161 IP 127.0.0.1.54120 > 127.0.0.1.8080: Flags [.], ack 207, win 511, options [nop,nop,TS val 516986610 ecr 516986610], length 0
E..4..@.@............h...............(.....
........
22:24:37.042277 IP 127.0.0.1.54120 > 127.0.0.1.8080: Flags [F.], seq 176, ack 207, win 512, options [nop,nop,TS val 516986610 ecr 516986610], length 0
E..4..@.@............h...............(.....
........
22:24:37.042322 IP 127.0.0.1.8080 > 127.0.0.1.54120: Flags [F.], seq 207, ack 177, win 512, options [nop,nop,TS val 516986610 ecr 516986610], length 0
E..4..@.@.. ...........h.............(.....
........
22:24:37.042332 IP 127.0.0.1.54120 > 127.0.0.1.8080: Flags [.], ack 208, win 512, options [nop,nop,TS val 516986610 ecr 516986610], length 0
E..4..@.@............h........./.....(.....
........
